{
  "schemaVersion": 1,
  "libraryId": "guandi-qing-collated-100",
  "version": "1.0.0",
  "displayName": "关帝灵签 · 清刊本校勘版100签",
  "entryCount": 100,
  "editorialPolicy": "以姑苏钮氏藏板清刊本签号与等级为准，固定维基文库转录辅助；底本与转录不同逐项登记，个别可疑刻字采用有记录的校订，第98签磨损字以固定古籍转录补足。异体字以可显示的Unicode汉字转写，保留繁体，不自动简繁或历法转换。",
  "lots": [
    {
      "id": "guandi-qing-001",
      "number": 1,
      "title": "第1签",
      "traditionalGrade": "大吉",
      "poemLines": [
        "巍巍獨步向雲間",
        "玉殿仙官第一班",
        "富貴榮華天付汝",
        "福如東海壽如山"
      ],
      "keywords": [
        "机会",
        "认可",
        "责任"
      ],
      "originalInterpretation": "高处行走、位居前列的景象表达被看见与获得机会。把注意力放在可交付的成果上，得到认可后也留出承担责任的余地。",
      "interpretationLicense": "MIT",
      "provenance": {
        "scanSourceId": "harvard-53239458-qing",
        "pdfPage": 3,
        "transcriptionUrl": "https://zh.wikisource.org/w/index.php?title=%E9%97%9C%E8%81%96%E5%B8%9D%E5%90%9B%E9%9D%88%E7%B1%A4%2F1&oldid=2610595",
        "revisionId": 2610595,
        "revisionTimestamp": "2025-10-30T15:21:15Z",
        "wikitextSha256": "2c9d8b71e00c95c04f415ce9ac544cfdfc88188f292d2462d1ad0ea2062e2660",
        "checkedOn": "2026-10-07",
        "status": "scan_collated_with_documented_variants",
        "reviewKind": "agent_visual_collation",
        "reviewSheet": "sources/review/check-001-005.jpg",
        "notes": [
          {
            "field": "poemLines[1]",
            "transcriptionReading": "玉殿千官第一班",
            "scanReading": "玉殿仙官第一班",
            "chosenReading": "玉殿仙官第一班",
            "reason": "逐页图像核对后依所选清刊本，不无声混用通行版本。"
          }
        ]
      },
      "assets": []
    },
    {
      "id": "guandi-qing-002",
      "number": 2,
      "title": "第2签",
      "traditionalGrade": "上吉",
      "poemLines": [
        "盈虛消息總天時",
        "自此君當百事宜",
        "若問前程歸縮地",
        "更須方寸好修為"
      ],
      "keywords": [
        "时机",
        "修为",
        "准备"
      ],
      "originalInterpretation": "盈亏变化提示进退要看时机，最后落在内心与行为的修整。先做好手边可控的工作，再判断是否适合扩大行动。",
      "interpretationLicense": "MIT",
      "provenance": {
        "scanSourceId": "harvard-53239458-qing",
        "pdfPage": 4,
        "transcriptionUrl": "https://zh.wikisource.org/w/index.php?title=%E9%97%9C%E8%81%96%E5%B8%9D%E5%90%9B%E9%9D%88%E7%B1%A4%2F2&oldid=2376270",
        "revisionId": 2376270,
        "revisionTimestamp": "2024-03-21T15:00:01Z",
        "wikitextSha256": "351cc7006fa5ddd5b49b25712ea80a41ee9ee854374ec79708476bb538295445",
        "checkedOn": "2026-10-07",
        "status": "scan_collated",
        "reviewKind": "agent_visual_collation",
        "reviewSheet": "sources/review/check-001-005.jpg",
        "notes": []
      },
      "assets": []
    },
    {
      "id": "guandi-qing-003",
      "number": 3,
      "title": "第3签",
      "traditionalGrade": "中吉",
      "poemLines": [
        "衣食自然生處有",
        "勸君不用苦勞心",
        "但能孝悌存忠信",
        "福祿來成禍不侵"
      ],
      "keywords": [
        "安稳",
        "关系",
        "诚信"
      ],
      "originalInterpretation": "诗把安稳生活与孝悌、忠信连在一起。经营可靠的关系和日常秩序，比不断担忧尚未发生的事更有帮助。",
      "interpretationLicense": "MIT",
      "provenance": {
        "scanSourceId": "harvard-53239458-qing",
        "pdfPage": 5,
        "transcriptionUrl": "https://zh.wikisource.org/w/index.php?title=%E9%97%9C%E8%81%96%E5%B8%9D%E5%90%9B%E9%9D%88%E7%B1%A4%2F3&oldid=2376475",
        "revisionId": 2376475,
        "revisionTimestamp": "2024-03-22T14:00:31Z",
        "wikitextSha256": "64e0707010ba84aff218790eddeafc560a117537a5034c0fc63693de6bad9f66",
        "checkedOn": "2026-10-07",
        "status": "scan_collated",
        "reviewKind": "agent_visual_collation",
        "reviewSheet": "sources/review/check-001-005.jpg",
        "notes": []
      },
      "assets": []
    },
    {
      "id": "guandi-qing-004",
      "number": 4,
      "title": "第4签",
      "traditionalGrade": "下下",
      "poemLines": [
        "去年百事頗相宜",
        "若較今年時運衰",
        "好把瓣香告神佛",
        "莫教福謝悔無追"
      ],
      "keywords": [
        "变化",
        "复盘",
        "谨慎"
      ],
      "originalInterpretation": "去年与今年的对照提醒过去的顺利不能直接沿用。检查环境变化、预算和承诺，放慢需要重新评估的动作。",
      "interpretationLicense": "MIT",
      "provenance": {
        "scanSourceId": "harvard-53239458-qing",
        "pdfPage": 6,
        "transcriptionUrl": "https://zh.wikisource.org/w/index.php?title=%E9%97%9C%E8%81%96%E5%B8%9D%E5%90%9B%E9%9D%88%E7%B1%A4%2F4&oldid=2376477",
        "revisionId": 2376477,
        "revisionTimestamp": "2024-03-22T14:03:33Z",
        "wikitextSha256": "864c1903d3422f4d7aff982b31c92a2b884cbfb6ae3cc3a54b5b3d7e1f5d1a93",
        "checkedOn": "2026-10-07",
        "status": "scan_collated_with_documented_variants",
        "reviewKind": "agent_visual_collation",
        "reviewSheet": "sources/review/check-001-005.jpg",
        "notes": [
          {
            "field": "traditionalGrade",
            "transcriptionReading": "下吉",
            "scanReading": "下下",
            "chosenReading": "下下",
            "reason": "等级依PDF原刻标题。"
          }
        ]
      },
      "assets": []
    },
    {
      "id": "guandi-qing-005",
      "number": 5,
      "title": "第5签",
      "traditionalGrade": "中平",
      "poemLines": [
        "子有三般不自由",
        "門庭蕭索冷如秋",
        "若逢牛鼠交承日",
        "萬事回春不用憂"
      ],
      "keywords": [
        "受限",
        "转折",
        "条件"
      ],
      "originalInterpretation": "冷落的门庭与回春形成转折，先承认当下受限。诗中的牛鼠是传统时间意象，不替用户换算日期；可先列出解困所需条件。",
      "interpretationLicense": "MIT",
      "provenance": {
        "scanSourceId": "harvard-53239458-qing",
        "pdfPage": 7,
        "transcriptionUrl": "https://zh.wikisource.org/w/index.php?title=%E9%97%9C%E8%81%96%E5%B8%9D%E5%90%9B%E9%9D%88%E7%B1%A4%2F5&oldid=2376479",
        "revisionId": 2376479,
        "revisionTimestamp": "2024-03-22T14:05:36Z",
        "wikitextSha256": "4c99880d66689b61918b1f584c47add5662bceebe7dc8cd16ea358c9f54d12b5",
        "checkedOn": "2026-10-07",
        "status": "scan_collated",
        "reviewKind": "agent_visual_collation",
        "reviewSheet": "sources/review/check-001-005.jpg",
        "notes": []
      },
      "assets": []
    },
    {
      "id": "guandi-qing-006",
      "number": 6,
      "title": "第6签",
      "traditionalGrade": "下下",
      "poemLines": [
        "何勞鼓瑟更吹笙",
        "寸步如登萬里程",
        "彼此懷疑不相信",
        "休將私意憶濃情"
      ],
      "keywords": [
        "信任",
        "沟通",
        "核实"
      ],
      "originalInterpretation": "乐声与漫长一步形成反差，核心是彼此缺少信任。不要用热情代替核实，先把双方的期待和实际承诺讲清楚。",
      "interpretationLicense": "MIT",
      "provenance": {
        "scanSourceId": "harvard-53239458-qing",
        "pdfPage": 8,
        "transcriptionUrl": "https://zh.wikisource.org/w/index.php?title=%E9%97%9C%E8%81%96%E5%B8%9D%E5%90%9B%E9%9D%88%E7%B1%A4%2F6&oldid=2376481",
        "revisionId": 2376481,
        "revisionTimestamp": "2024-03-22T14:08:03Z",
        "wikitextSha256": "1849767e9457fbcb4afc72ac0d21aef07d1f350889cc59fe23aa3aa578b71ed3",
        "checkedOn": "2026-10-07",
        "status": "scan_collated_with_documented_variants",
        "reviewKind": "agent_visual_collation",
        "reviewSheet": "sources/review/check-006-010.jpg",
        "notes": [
          {
            "field": "traditionalGrade",
            "transcriptionReading": "下平",
            "scanReading": "下下",
            "chosenReading": "下下",
            "reason": "等级依PDF原刻标题。"
          }
        ]
      },
      "assets": []
    },
    {
      "id": "guandi-qing-007",
      "number": 7,
      "title": "第7签",
      "traditionalGrade": "大吉",
      "poemLines": [
        "仙風道骨本天成",
        "又遇仙宗為主盟",
        "指日丹成謝巖谷",
        "一朝引領向天行"
      ],
      "keywords": [
        "学习",
        "引导",
        "积累"
      ],
      "originalInterpretation": "炼丹与遇到引路者描写长期积累得到指点。寻找能提供具体反馈的人，把理想拆成持续练习与阶段成果。",
      "interpretationLicense": "MIT",
      "provenance": {
        "scanSourceId": "harvard-53239458-qing",
        "pdfPage": 9,
        "transcriptionUrl": "https://zh.wikisource.org/w/index.php?title=%E9%97%9C%E8%81%96%E5%B8%9D%E5%90%9B%E9%9D%88%E7%B1%A4%2F7&oldid=2376483",
        "revisionId": 2376483,
        "revisionTimestamp": "2024-03-22T14:10:28Z",
        "wikitextSha256": "4cc74ecf6c78a61ca6d44f2f807b3155c1ced0e6f8b4ebe2547a157d9dc0a402",
        "checkedOn": "2026-10-07",
        "status": "scan_collated_with_documented_variants",
        "reviewKind": "agent_visual_collation",
        "reviewSheet": "sources/review/check-006-010.jpg",
        "notes": [
          {
            "field": "poemLines[0]",
            "transcriptionReading": "仙風道骨本天生",
            "scanReading": "仙風道骨本天成",
            "chosenReading": "仙風道骨本天成",
            "reason": "逐页图像核对后依所选清刊本，不无声混用通行版本。"
          }
        ]
      },
      "assets": []
    },
    {
      "id": "guandi-qing-008",
      "number": 8,
      "title": "第8签",
      "traditionalGrade": "上上",
      "poemLines": [
        "年來耕稼苦無收",
        "今歲田疇定有秋",
        "況遇太平無事日",
        "士農商賈百無憂"
      ],
      "keywords": [
        "耕耘",
        "收获",
        "持续"
      ],
      "originalInterpretation": "辛苦耕作到收成的转换强调投入需要一个生长周期。保留有效的方法，检查哪些努力已接近可见结果。",
      "interpretationLicense": "MIT",
      "provenance": {
        "scanSourceId": "harvard-53239458-qing",
        "pdfPage": 10,
        "transcriptionUrl": "https://zh.wikisource.org/w/index.php?title=%E9%97%9C%E8%81%96%E5%B8%9D%E5%90%9B%E9%9D%88%E7%B1%A4%2F8&oldid=2376485",
        "revisionId": 2376485,
        "revisionTimestamp": "2024-03-22T14:13:44Z",
        "wikitextSha256": "d4d0be910ab638402d7f3d999bf97454be9f58bfb086eac6a3764d2f8551a4da",
        "checkedOn": "2026-10-07",
        "status": "scan_collated_with_documented_variants",
        "reviewKind": "agent_visual_collation",
        "reviewSheet": "sources/review/check-006-010.jpg",
        "notes": [
          {
            "field": "poemLines[3]",
            "transcriptionReading": "士農工賈百無憂",
            "scanReading": "士農商賈百無憂",
            "chosenReading": "士農商賈百無憂",